{
  "$schema": "http://json-schema.org/draft-07/schema#",
  "$id": "https://github.com/rmems/operation-prometheus/schemas/pr_trajectory.schema.json",
  "title": "PR Trajectory v0",
  "description": "Initial JSON schema for a software-engineering trajectory extracted from a public GitHub PR. This is schema v0 (not final). See GitHub issue #2.",
  "type": "object",
  "required": [
    "id",
    "repo",
    "pr_number",
    "source_urls",
    "language",
    "domain",
    "task_type",
    "before_context",
    "patch",
    "validation",
    "outcome",
    "training_use"
  ],
  "properties": {
    "id": {
      "type": "string",
      "minLength": 1,
      "description": "Stable identifier for this trajectory record (e.g. repo-pr-123 or hash)."
    },
    "repo": {
      "type": "string",
      "pattern": "^[a-zA-Z0-9](?:[a-zA-Z0-9-]{0,37}[a-zA-Z0-9])?/[a-zA-Z0-9][a-zA-Z0-9_.-]{0,99}$",
      "description": "GitHub repository in owner/repo form. Owner must be a valid GitHub user or organization login (alphanumeric or hyphen, 1-39 chars, cannot start or end with hyphen). Repo name follows GitHub rules."
    },
    "pr_number": {
      "type": "integer",
      "minimum": 1,
      "description": "Pull request number within the repo."
    },
    "source_urls": {
      "type": "array",
      "minItems": 1,
      "items": {
        "type": "string",
        "format": "uri",
        "pattern": "^https://github\\.com/[A-Za-z0-9_.-]+/[A-Za-z0-9_.-]+/(pull|issues)/[0-9]+(?:#.*)?$"
      },
      "description": "Public GitHub PR/issue URLs that contributed provenance or review signal. MUST include the canonical PR URL for the declared repo and pr_number (https://github.com/{repo}/pull/{pr_number}). Cross-repo supplemental links are allowed but the primary trajectory's own PR must be present for auditability."
    },
    "language": {
      "type": "string",
      "description": "Primary programming language of the change (e.g. Rust, Python, Julia).",
      "minLength": 1
    },
    "domain": {
      "type": "string",
      "description": "Application domain (e.g. ML-infra, systems, data-pipeline, web).",
      "minLength": 1
    },
    "task_type": {
      "type": "string",
      "enum": [
        "bugfix",
        "feature",
        "refactor",
        "docs",
        "test",
        "perf",
        "security",
        "chore",
        "other"
      ],
      "description": "High-level classification of the engineering task."
    },
    "issue_context": {
      "type": "string",
      "description": "Summary of the originating issue or motivation (public text only).",
      "minLength": 1
    },
    "review_signals": {
      "type": "array",
      "items": {
        "type": "object",
        "properties": {
          "author": {
            "type": "string",
            "minLength": 1
          },
          "comment": {
            "type": "string",
            "minLength": 1
          },
          "suggestion": {
            "type": "string",
            "minLength": 1
          }
        },
        "required": [],
        "additionalProperties": false,
        "anyOf": [
          {
            "required": [
              "comment"
            ]
          },
          {
            "required": [
              "suggestion"
            ]
          }
        ]
      },
      "description": "Key review comments or suggestions that drove changes. Each item must include a non-empty comment or suggestion.",
      "minItems": 1
    },
    "before_context": {
      "type": "string",
      "minLength": 1,
      "description": "Relevant code/state before the patch (snippets or file references)."
    },
    "patch": {
      "type": "string",
      "minLength": 1,
      "description": "Unified diff or structured patch representing the fix/implementation."
    },
    "validation": {
      "type": "array",
      "minItems": 1,
      "items": {
        "type": "object",
        "properties": {
          "type": {
            "type": "string",
            "enum": [
              "ci",
              "test",
              "manual",
              "review",
              "other"
            ]
          },
          "result": {
            "type": "string",
            "enum": [
              "pass",
              "fail",
              "flaky"
            ]
          },
          "detail": {
            "type": "string",
            "minLength": 1
          }
        },
        "required": [
          "type",
          "result"
        ],
        "additionalProperties": false
      },
      "description": "Validation events (CI runs, test results, manual verification) after the change."
    },
    "outcome": {
      "type": "string",
      "enum": [
        "merged",
        "closed",
        "superseded",
        "abandoned",
        "open"
      ],
      "description": "Final state of the PR. Use open for still-active unmerged PRs."
    },
    "training_use": {
      "type": "string",
      "enum": [
        "repair",
        "autocomplete",
        "review-to-patch",
        "bug-prediction",
        "validation",
        "other"
      ],
      "description": "Intended primary training signal this trajectory provides."
    },
    "quality_score": {
      "type": "number",
      "minimum": 0,
      "maximum": 1,
      "description": "Optional human or heuristic quality score for filtering (0-1)."
    }
  },
  "additionalProperties": false,
  "anyOf": [
    {
      "required": [
        "issue_context"
      ]
    },
    {
      "required": [
        "review_signals"
      ]
    }
  ],
  "if": {
    "required": ["training_use"],
    "properties": {
      "training_use": { "const": "review-to-patch" }
    }
  },
  "then": {
    "required": ["review_signals"],
    "properties": {
      "review_signals": { "minItems": 1 }
    }
  }
}
